{
  "schemaVersion": "chimpmaera.bi/dashboard-set/v1",
  "contractVersion": "1.0.0",
  "dashboardSetId": "dashboard-set:crm-erp-reconciliation-v1",
  "defaultEnabled": false,
  "evidenceClass": "LOCAL_SYNTHETIC",
  "semanticBinding": {
    "schemaVersion": "chimpmaera.bi/semantic-model/v1",
    "modelVersion": "1.0.0",
    "modelId": "semantic-model:crm-erp-reconciliation-v1",
    "modelDigest": "11c9a4c89b8fcee1a528fb6dbf339aa0460d4d8c02412d6330200e03c154913f"
  },
  "pages": [
    { "id": "page:kpi-overview", "label": "CRM and ERP reconciliation overview", "landmark": "main" },
    { "id": "page:reconciled-fact-detail", "label": "Reconciled fact detail", "landmark": "section" }
  ],
  "kpis": [
    { "id": "measure:crm-amount-minor", "label": "Matched CRM amount", "unit": "EUR_MINOR", "formula": "SUM(MATCHED.crm.amount_major * 100)", "semanticValuePath": "/kpis/crmAmountMinor", "semanticFormulaPath": "/measures/0/formula" },
    { "id": "measure:erp-order-total-minor", "label": "Matched ERP order total", "unit": "EUR_MINOR", "formula": "SUM(MATCHED.erp.total_minor)", "semanticValuePath": "/kpis/erpOrderTotalMinor", "semanticFormulaPath": "/measures/1/formula" },
    { "id": "measure:reconciliation-delta-minor", "label": "Reconciliation delta", "unit": "EUR_MINOR", "formula": "measure:crm-amount-minor - measure:erp-order-total-minor", "semanticValuePath": "/kpis/reconciliationDeltaMinor", "semanticFormulaPath": "/measures/2/formula" }
  ],
  "filters": [
    { "id": "filter:tenant", "dimensionId": "dimension:tenant", "allowedValues": ["tenant:synthetic-zoo"], "required": true },
    { "id": "filter:currency", "dimensionId": "dimension:currency", "allowedValues": ["EUR"], "required": true },
    { "id": "filter:outcome", "dimensionId": "dimension:outcome", "allowedValues": ["MATCHED"], "required": true }
  ],
  "drillThrough": {
    "selector": "CANONICAL_ID_ONLY",
    "visibleFields": ["canonicalId", "outcome", "crmAmountMinor", "erpTotalMinor", "deltaMinor", "currency", "freshness", "trust", "sanitizedLineage"],
    "roleHiddenFields": ["crmOpportunityId", "erpOrderId", "sourceIds", "sourceRecordId", "sourceDigest", "batchId", "datasetId", "exportId"],
    "rawSourceIdsVisible": false,
    "lineageSanitization": "SHA256_PREFIX_12"
  },
  "freshness": { "maxModelAgeSeconds": 3600, "staleBehavior": "BLOCK" },
  "accessibility": {
    "interactionMode": "KEYBOARD_AND_POINTER",
    "semanticStructure": ["main", "h1", "section", "h2", "article", "dl", "table", "caption", "th"],
    "meaningfulLabelsRequired": true,
    "focusVisibleRequired": true,
    "contrast": { "background": "#ffffff", "text": "#1f2937", "secondaryText": "#374151", "link": "#0b4f6c", "focus": "#005fcc", "normalTextMinimum": 4.5, "nonTextMinimum": 3 }
  },
  "limitations": [
    "Local synthetic readback only; no production analytics service or SLA.",
    "Only BI-004 MATCHED EUR facts contribute; unresolved and stale facts are excluded.",
    "Filters are intentionally fixed to one synthetic tenant, EUR, and MATCHED outcome.",
    "Accessibility checks are deterministic contract tests, not certification.",
    "No write-back, operational command, forecast, decision automation, or financial assurance."
  ],
  "authorityBoundary": {
    "readOnly": true,
    "dashboardWritesAllowed": false,
    "crmWritesAllowed": false,
    "erpWritesAllowed": false,
    "catalogueWritesAllowed": false,
    "policyWritesAllowed": false,
    "effectDispatchAllowed": false,
    "hiddenLineageDisclosureAllowed": false
  },
  "contractDigest": "53e51d30cb093fffe08177439396080f1b47a7475e93e3e52888a2b785d28f70"
}
